{
  "schema_version": 1,
  "inputs": {
    "corpus_sha256": "47f06033836fd8cb11e912148f5402faf71142daa86ce1f7b425d59675692b42",
    "candidate_manifest_sha256": "31714c42caf0f7949e3a96e6c711f334c9dd680fa191eaefc486a4eb3ade85fa"
  },
  "corpus": {
    "case_count": 92,
    "positive_count": 62,
    "hard_negative_count": 30,
    "excluded_review_count": 2408
  },
  "baseline": {
    "sentence_counts": {
      "tp": 41,
      "fp": 0,
      "fn": 21,
      "tn": 30
    },
    "occurrence_counts": {
      "tp": 46,
      "fp": 13,
      "fn": 64
    }
  },
  "combined_candidate": {
    "sentence_counts": {
      "tp": 47,
      "fp": 0,
      "fn": 15,
      "tn": 30
    },
    "occurrence_counts": {
      "tp": 61,
      "fp": 12,
      "fn": 49
    },
    "sentence_delta": {
      "tp": 6,
      "fp": 0,
      "fn": -6,
      "tn": 0
    },
    "occurrence_delta": {
      "tp": 15,
      "fp": -1,
      "fn": -15
    },
    "positive_case_support": 17,
    "hard_negative_case_support": 30,
    "tuning_gate_passed": false
  },
  "candidates": [
    {
      "candidate_id": "core.literal.pf007.001",
      "positive_case_support": 13,
      "hard_negative_case_support": 30,
      "sentence_tp_delta": 6,
      "sentence_fp_delta": 0,
      "occurrence_tp_delta": 12,
      "occurrence_fp_delta": 4,
      "tuning_gate_passed": true
    },
    {
      "candidate_id": "core.literal.pf007.002",
      "positive_case_support": 3,
      "hard_negative_case_support": 30,
      "sentence_tp_delta": 0,
      "sentence_fp_delta": 0,
      "occurrence_tp_delta": 2,
      "occurrence_fp_delta": -2,
      "tuning_gate_passed": true
    },
    {
      "candidate_id": "core.literal.pf007.007",
      "positive_case_support": 2,
      "hard_negative_case_support": 30,
      "sentence_tp_delta": 0,
      "sentence_fp_delta": 0,
      "occurrence_tp_delta": 1,
      "occurrence_fp_delta": 1,
      "tuning_gate_passed": false
    }
  ]
}
